{
  "$schema": "https://json-schema.org/draft/2020-12/schema",
  "$id": "https://quarto-video.local/registry/animation.json",
  "title": "Animation preset",
  "description": "Data contract of one animation preset (PRD §5.6). Static data only: the frame function lives in renderer/remotion/animations, keyed by id. No functions, no pixels, no CSS.",
  "type": "object",
  "additionalProperties": false,
  "required": [
    "id",
    "version",
    "purpose",
    "compatibleComponents",
    "minFrames",
    "shortScene",
    "reducedMotion",
    "role",
    "windowed"
  ],
  "properties": {
    "id": {
      "type": "string",
      "pattern": "^[a-z][a-z0-9-]*$",
      "maxLength": 64
    },
    "version": {
      "type": "string",
      "pattern": "^[0-9]+\\.[0-9]+\\.[0-9]+$"
    },
    "purpose": {
      "type": "string",
      "minLength": 1,
      "maxLength": 200
    },
    "compatibleComponents": {
      "type": "array",
      "minItems": 1,
      "uniqueItems": true,
      "items": {
        "type": "string",
        "pattern": "^[a-z][a-z0-9-]*$",
        "maxLength": 64
      }
    },
    "minFrames": {
      "type": "integer",
      "minimum": 1
    },
    "shortScene": {
      "description": "What a scene shorter than minFrames shows. static: the end state from its first frame.",
      "enum": [
        "static"
      ]
    },
    "reducedMotion": {
      "description": "What the preset draws when reduced motion is requested (task 023). static: the end state from its first frame.",
      "enum": [
        "static"
      ]
    },
    "role": {
      "description": "entrance: an animation (scene attribute animation). exit: an exit (scene attribute exit). ADR-0020.",
      "enum": [
        "entrance",
        "exit"
      ]
    },
    "windowed": {
      "description": "true: the preset runs over one window that the scene attribute animationDuration can set (ADR-0020). false: the preset has its own schedule and animationDuration is an error.",
      "type": "boolean"
    }
  }
}
